{
  "schemaVersion": 1,
  "name": "Sample — Credit Card",
  "layoutMode": "free",
  "unit": "px",
  "page": { "size": "IDCard", "orientation": "landscape", "margins": { "top": 0, "right": 0, "bottom": 0, "left": 0 }, "columns": 1 },
  "parameters": [],
  "connections": [],
  "styles": {},
  "bands": [],
  "dataSources": [],
  "body": {
    "height": 204,
    "elements": [
      { "id": "bg", "type": "rectangle", "bounds": { "x": 0, "y": 0, "width": 324, "height": 204 }, "style": { "background": "#1e293b", "border": { "top": 0, "right": 0, "bottom": 0, "left": 0, "color": "#1e293b" } } },
      { "id": "accent", "type": "rectangle", "bounds": { "x": 0, "y": 0, "width": 324, "height": 6 }, "style": { "background": "#3b82f6", "border": { "top": 0, "right": 0, "bottom": 0, "left": 0, "color": "#3b82f6" } } },
      { "id": "bank", "type": "label", "text": "ACME BANK", "bounds": { "x": 18, "y": 18, "width": 220, "height": 22 }, "style": { "font": { "size": 14, "bold": true }, "color": "#f8fafc" } },
      { "id": "chip", "type": "rectangle", "bounds": { "x": 24, "y": 62, "width": 44, "height": 34 }, "style": { "background": "#d4af37", "border": { "top": 1, "right": 1, "bottom": 1, "left": 1, "color": "#a97c1e" } } },
      { "id": "wave", "type": "label", "text": ")))", "bounds": { "x": 74, "y": 62, "width": 40, "height": 34 }, "style": { "font": { "size": 15 }, "color": "#cbd5e1", "vAlign": "middle" } },
      { "id": "num", "type": "label", "text": "4242  4242  4242  4242", "bounds": { "x": 18, "y": 114, "width": 300, "height": 24 }, "style": { "font": { "family": "Consolas", "size": 15 }, "color": "#f8fafc" } },
      { "id": "validlbl", "type": "label", "text": "VALID THRU", "bounds": { "x": 18, "y": 148, "width": 80, "height": 12 }, "style": { "font": { "size": 6 }, "color": "#94a3b8" } },
      { "id": "valid", "type": "label", "text": "12 / 28", "bounds": { "x": 18, "y": 160, "width": 80, "height": 16 }, "style": { "font": { "size": 10 }, "color": "#f8fafc" } },
      { "id": "holder", "type": "label", "text": "CARD HOLDER", "bounds": { "x": 18, "y": 182, "width": 200, "height": 14 }, "style": { "font": { "size": 9 }, "color": "#f1f5f9" } },
      { "id": "network", "type": "label", "text": "ACME", "bounds": { "x": 244, "y": 166, "width": 64, "height": 26 }, "style": { "font": { "size": 14, "bold": true, "italic": true }, "color": "#f8fafc", "align": "right" } }
    ]
  }
}
