{
  "schemaVersion": 1,
  "name": "Sample - Regional sales heatmap",
  "layoutMode": "free",
  "unit": "px",
  "page": {
    "size": "A4",
    "orientation": "portrait",
    "margins": {
      "top": 40,
      "right": 40,
      "bottom": 40,
      "left": 40
    },
    "columns": 1
  },
  "parameters": [],
  "connections": [],
  "styles": {},
  "bands": [],
  "dataSources": [
    {
      "name": "sales",
      "kind": "json",
      "fields": [],
      "json": {
        "inlineData": "[{\"region\": \"North\", \"quarter\": \"Q1\", \"revenue\": 38.2}, {\"region\": \"North\", \"quarter\": \"Q2\", \"revenue\": 45.3}, {\"region\": \"North\", \"quarter\": \"Q3\", \"revenue\": 59.1}, {\"region\": \"North\", \"quarter\": \"Q4\", \"revenue\": 62.1}, {\"region\": \"South\", \"quarter\": \"Q1\", \"revenue\": 90.4}, {\"region\": \"South\", \"quarter\": \"Q2\", \"revenue\": 108.5}, {\"region\": \"South\", \"quarter\": \"Q3\", \"revenue\": 125.2}, {\"region\": \"South\", \"quarter\": \"Q4\", \"revenue\": 149.5}, {\"region\": \"East\", \"quarter\": \"Q1\", \"revenue\": 135.4}, {\"region\": \"East\", \"quarter\": \"Q2\", \"revenue\": 170.1}, {\"region\": \"East\", \"quarter\": \"Q3\", \"revenue\": 197.3}, {\"region\": \"East\", \"quarter\": \"Q4\", \"revenue\": 228.3}, {\"region\": \"West\", \"quarter\": \"Q1\", \"revenue\": 199.2}, {\"region\": \"West\", \"quarter\": \"Q2\", \"revenue\": 247.3}, {\"region\": \"West\", \"quarter\": \"Q3\", \"revenue\": 284.2}, {\"region\": \"West\", \"quarter\": \"Q4\", \"revenue\": 329.2}]",
        "resultPath": "$"
      }
    }
  ],
  "body": {
    "height": 520,
    "elements": [
      {
        "id": "title",
        "type": "label",
        "text": "Regional Sales - Revenue by Quarter",
        "bounds": {
          "x": 0,
          "y": 0,
          "width": 500,
          "height": 26
        },
        "style": {
          "font": {
            "size": 16,
            "bold": true
          }
        }
      },
      {
        "id": "subtitle",
        "type": "label",
        "text": "Colour scale demo: darker fill = higher revenue. Region/quarter pivot below, per-region total column on the right.",
        "bounds": {
          "x": 0,
          "y": 28,
          "width": 500,
          "height": 32
        },
        "style": {
          "color": "#6b7280",
          "font": {
            "size": 9
          }
        }
      },
      {
        "id": "matrixLabel",
        "type": "label",
        "text": "Revenue by region and quarter",
        "bounds": {
          "x": 0,
          "y": 68,
          "width": 400,
          "height": 18
        },
        "style": {
          "font": {
            "size": 10,
            "bold": true
          }
        }
      },
      {
        "id": "matrix",
        "type": "matrix",
        "bounds": {
          "x": 0,
          "y": 88,
          "width": 460,
          "height": 160
        },
        "matrix": {
          "dataSource": "sales",
          "rowField": "{sales.region}",
          "rowHeader": "Region",
          "columnField": "{sales.quarter}",
          "valueField": "{sales.revenue}",
          "aggregate": "sum",
          "format": "n0",
          "showRowTotals": true,
          "showColumnTotals": true,
          "colorScale": {
            "lowColor": "#eff6ff",
            "highColor": "#1d4ed8"
          }
        }
      },
      {
        "id": "tableLabel",
        "type": "label",
        "text": "Per-region detail (colour scale on the Revenue column)",
        "bounds": {
          "x": 0,
          "y": 270,
          "width": 400,
          "height": 18
        },
        "style": {
          "font": {
            "size": 10,
            "bold": true
          }
        }
      },
      {
        "id": "table",
        "type": "table",
        "bounds": {
          "x": 0,
          "y": 292,
          "width": 320,
          "height": 220
        },
        "table": {
          "dataSource": "sales",
          "showHeader": true,
          "columns": [
            {
              "header": "Region",
              "value": "{sales.region}",
              "width": 90,
              "align": "left"
            },
            {
              "header": "Quarter",
              "value": "{sales.quarter}",
              "width": 70,
              "align": "left"
            },
            {
              "header": "Revenue",
              "value": "{sales.revenue}",
              "format": "n1",
              "width": 100,
              "align": "right",
              "colorScale": {
                "lowColor": "#fef9c3",
                "midColor": "#fb923c",
                "highColor": "#b91c1c"
              }
            }
          ]
        }
      }
    ]
  }
}
