{
  "schemaVersion": 1,
  "name": "Sample — Personnel ID Card",
  "layoutMode": "free",
  "unit": "px",
  "page": { "size": "IDCard", "orientation": "portrait", "margins": { "top": 0, "right": 0, "bottom": 0, "left": 0 }, "columns": 1 },
  "parameters": [],
  "connections": [],
  "styles": {},
  "bands": [],
  "dataSources": [],
  "body": {
    "height": 324,
    "elements": [
      { "id": "bg", "type": "rectangle", "bounds": { "x": 0, "y": 0, "width": 204, "height": 324 }, "style": { "background": "#ffffff", "border": { "top": 1, "right": 1, "bottom": 1, "left": 1, "color": "#cbd5e1" } } },
      { "id": "header", "type": "rectangle", "bounds": { "x": 0, "y": 0, "width": 204, "height": 54 }, "style": { "background": "#1d4ed8", "border": { "top": 0, "right": 0, "bottom": 0, "left": 0, "color": "#1d4ed8" } } },
      { "id": "company", "type": "label", "text": "ACME CORPORATION", "bounds": { "x": 12, "y": 17, "width": 180, "height": 20 }, "style": { "font": { "size": 11, "bold": true }, "color": "#ffffff" } },
      { "id": "photobox", "type": "rectangle", "bounds": { "x": 62, "y": 70, "width": 80, "height": 100 }, "style": { "background": "#e2e8f0", "border": { "top": 1, "right": 1, "bottom": 1, "left": 1, "color": "#cbd5e1" } } },
      { "id": "photolbl", "type": "label", "text": "PHOTO", "bounds": { "x": 62, "y": 112, "width": 80, "height": 16 }, "style": { "font": { "size": 8 }, "color": "#94a3b8", "align": "center" } },
      { "id": "name", "type": "label", "text": "JANE DOE", "bounds": { "x": 12, "y": 182, "width": 180, "height": 24 }, "style": { "font": { "size": 13, "bold": true }, "color": "#0f172a", "align": "center" } },
      { "id": "title", "type": "label", "text": "Software Engineer", "bounds": { "x": 12, "y": 208, "width": 180, "height": 16 }, "style": { "font": { "size": 9 }, "color": "#475569", "align": "center" } },
      { "id": "dept", "type": "label", "text": "Engineering · HQ", "bounds": { "x": 12, "y": 226, "width": 180, "height": 14 }, "style": { "font": { "size": 8 }, "color": "#64748b", "align": "center" } },
      { "id": "rule", "type": "line", "bounds": { "x": 16, "y": 252, "width": 172, "height": 0 }, "style": { "border": { "top": 1, "right": 1, "bottom": 1, "left": 1, "color": "#e2e8f0" } } },
      { "id": "idlbl", "type": "label", "text": "EMPLOYEE ID", "bounds": { "x": 16, "y": 262, "width": 172, "height": 12 }, "style": { "font": { "size": 6 }, "color": "#94a3b8", "align": "center" } },
      { "id": "id", "type": "label", "text": "EMP-00423", "bounds": { "x": 16, "y": 274, "width": 172, "height": 18 }, "style": { "font": { "family": "Consolas", "size": 12 }, "color": "#0f172a", "align": "center" } },
      { "id": "barcode", "type": "rectangle", "bounds": { "x": 32, "y": 298, "width": 140, "height": 16 }, "style": { "background": "#0f172a", "border": { "top": 0, "right": 0, "bottom": 0, "left": 0, "color": "#0f172a" } } }
    ]
  }
}
